<!ELEMENT books (book*)>
<!ELEMENT book (ISBN, Title, Year, Lang, Author)>

<!ATTLIST book  
    id CDATA #REQUIRED
>
<!ELEMENT ISBN (#PCDATA)>
<!ELEMENT Title (#PCDATA)>
<!ELEMENT Year (#PCDATA)>
<!ELEMENT Lang (#PCDATA)>
<!ELEMENT Author (#PCDATA)>
